Title,Category,Auther,Date,Location,Content,URL
कोरोना परीक्षण गर्न नमानेका दुर्ईजनाको मृत्यु,स्थानीय,प्रतीक दैनिक,"जेष्ठ २१, २०७८",२१ जेठ/रासस,"कोरोना परीक्षण गर्न अस्वीकार गरेका दुर्ईजना पुरुषको मृत्यु भएको छ। एन्टिजेन परीक्षणका लागि स्वास्थ्यकर्मीको टोली गाउँमैं गएको समयमा परीक्षणका लागि गरिएको आग्रह अस्वीकार गरेका फिदिम नगरपालिका–८ का दुईजना पुरुषको बिहीवार मृत्यु भएको हो।. उनीहरूको कोरोनाका लक्षणसँग मिल्ने स्वास्थ्य समस्याका कारण मृत्यु भएको हो।. फिदिम–८ को कागते र घुमाउनेटार घर भएका क्रमशः ७२ र ६२ वर्षीय पुरुषको मृत्यु भएको वडाध्यक्ष शेरबहादुर नेम्वाङले जानकारी दिए।. उनका अनुसार लक्षण देखिएका उनीहरूको परीक्षण हुन सकेको थिएन। “वडामा टोली आउँदा परीक्षण गराऔं भनेर मैले नै भनेको हुँ, मान्नुभएको थिएन,” वडाध्यक्ष नेम्वाङले भने, “हिजो दुःखद घटना भयो।” उनीहरूमा ज्वरो आउने, टाउको दुख्ने, खोकी लाग्ने जस्ता स्वास्थ्य समस्या थिए। एकको बिहीवार अपराह्न ३ः०० बजे घरैमैं मृत्यु भएको थियो भने अर्कालाई श्वासप्रश्वासमा समस्या भएपछि उपचारका लागि फिदिम ल्याउने क्रममा राति ९ः०० बजे बाटैमा मृत्यु भएको वडाध्यक्ष नेम्वाङले जानकारी दिए।",https://eprateekdaily.com/2021/06/04/14165
दुई धुर जमीनको विवादमा रामको हत्या,स्थानीय,प्रतीक दैनिक,"जेष्ठ २१, २०७८",रक्सौल,"भारत, मोतीहारी जिल्लाको कल्याणपुर थाना क्षेत्रको दीक्षित पकडी गाउँमा दुई धुर जमीनको लागि एकजनाको हत्या भएको छ।. दुई धुर जमीन विवादमा सो गाउँका वासुदेव रामले मुखलाल राम र उनका परिवारलाई कुटपिट गरेका थिए। कुटपिटपछि रामले बन्चरो प्रहार गरी मुखलाल रामको हत्या गरेका थिए। घटनामा मुखलालकी पत्नी अतवारिया देवीलगायत दुईजना घाइते भएका छन्। घाइतेको स्थानीय अस्पतालमा उपचार भइरहेको छ।. प्रहरीले शव शल्यपरीक्षणको लागि अस्पताल पठाएको छ भने मुखलालको खोजी गरिरहेको जनाएको छ।",https://eprateekdaily.com/2021/06/04/14169
भालुको आक्रमणबाट घिमिरे गम्भीर घाइते,स्थानीय,प्रतीक दैनिक,"जेष्ठ २१, २०७८",ठोरी,"ठोरी गाउँपालिका–३ मा भालुको आक्रमणबाट एकजना गम्भीर घाइते भएका छन्।. शुक्रवार बिहान धानको ब्याडमा पानी लगाउन गाउँँ नजीकैको सामुदायिक वनमा गएका ब्रह्मानगरका ४७ वर्षीय इन्द्रप्रसाद घिमिरेलाई भालुले आक्रमण गरेर गम्भीर घाइते बनाएको हो।. बिहान ६ः३० बजे ब्रह्मानगरबाट करीब २०/२५ मिनेटको पैदल दूरीमा पर्ने बेदघारी सामुदायिक वनभित्र रहेको सिंचाइ कुलोको मुहान गाउँतर्फ फर्काउन एक्लै गएका घिमिरेलाई अकस्मात् दुईवटा भालुले आक्रमण गरेको थियो। कुलोको मुहान नजीकै रहेका भालुले आक्रमण गर्दा घिमिरेको टाउको, कोख र तिघ्रामा गम्भीर चोट लागेको छ।. उनलाई विजयबस्तीस्थित स्वास्थ्य चौकीमा प्राथमिक उपचारपश्चात् थप उपचारका लागि वीरगंजको भवानी अस्पतालमा लगिएको छ।. गत वैशाख २९ गते ठोरी गापा–३, रामनगरका एक दम्पती भालुको आक्रमणमा परेर घाइते भएका थिए भने त्यसको २ दिनपछि ठोरी गापा–४, ठाडोलाइनका ७१ वर्षीय वृद्धालाई भालुले आक्रमण गरेर घाइते बनाएको थियो।",https://eprateekdaily.com/2021/06/04/14162
पर्सामा सङ्क्रमण दर घट्दै,स्थानीय,प्रतीक दैनिक,"जेष्ठ २०, २०७८",वीरगंज,"नारायणी अस्पतालमा पिसिआर परीक्ष्Fण रिपोर्टबाट कोरोना सङ्क्रमितहरूको सङ्ख्या घट्दै छ। एक सातायतादेखि अस्पतालको पिसिआर रिपोर्टबाट सङ्क्रमित सङ्ख्या घटेको पुष्टि भएको हो।. बुधवार साँझ १६० जनाको स्वाब परीक्षण गर्दा १४ जना सङ्क्रमित पुष्टि भएको अस्पतालका कोरोना फोकल पर्सन डा सरोजरोशन दासले बताए। सङ्क्रमित हुनेमा पर्साका ९, बारा/सर्लाहीका २/२ र रौतहटका १ जना छन्। उनीहरूको उमेर २४ देखि ८५ वर्ष रहेको र सिटी भ्यालू १८.२ देखि ३५.४ रहेको डा दासले बताए।. यसैबीच, नारायणी अस्पतालमा बिहीवार ४ जना सङ्क्रमितको मृत्यु भएको अस्पतालका कोभिड संयोजक डा उदयनारायण सिंहले बताए। बिहान अढाई बजे रौतहट, गुजरा नगरपालिका–७ निवासी ७० वर्षीया महिलाको मृत्यु भएको हो। उनले कोरोनाको पहिलो खोप लगाएकी थिइन्। महिलालाई जेठ १८ गते भर्ना गरिएको र उनमा जेठ १९ गते सङ्क्रमण पुष्टि भएको थियो।. यसैगरी, वीरगंज–१७ अलौं निवासी ८० वर्षीय पुरुषको बिहान करीब ८ बजेतिर निधन भएको डा सिंहले बताए। उनले कोभिडविरुद्धको खोप लिएका थिएनन्। १७ गते भर्ना भएका उनको उपचारको क्रममा मृत्यु भएको हो।. यसैगरी, वीरगंज–१६ नगवा निवासी ५५ वर्षीय पुरुषको दिउँसो १२ः३० बजे निधन भएको थियो। यिनले पनि कोभिडविरुद्ध खोप लिएका थिएनन्। ११ गते भर्ना भएका यिनमा १९ गते सङ्क्रमण पुष्टि भएको थियो। यसैगरी, रौतहटको धाराहरि नगरपालिका–९ निवासी ४५ वर्षीया महिलाको आज दिउँसो २ः३० बजे निधन भएको छ। वैशाख २७ गते सङ्क्रमण भएपछि भर्ना भएकी उनको आज निधन भएको हो। यी महिलाले पनि कोरोनाविरुद्धको खोप लिएकी थिइनन्।",https://eprateekdaily.com/2021/06/03/14132
स्थानीय तहको सामूहिक अग्रसरतामा कोभिड अस्पताल,स्थानीय,प्रतीक दैनिक,"जेष्ठ २१, २०७८",२१ जेठ/रासस,"कोभिड–१९ सङ्क्रमणको अति जोखिम क्षेत्रमा महोत्तरीका पाँच स्थानीय तहको संयुक्त पहलकदमीमा सुविधायुक्त कोभिड अस्पताल सञ्चालनमा आएको छ। जिल्लाको रामगोपालपुर नगरपालिका–९ पर्सादेवाडस्थित निर्माणाधीन जानकी एकेडेमी अस्पतालको भवनमा पाँच स्थानीय तह र निवर्तमान प्रतिनिधिसभा सदस्यको संयुक्त पहलकदमीमा ५० शय्याको कोभिड अस्पताल बिहीवार सञ्चालनमा ल्याइएको हो। निवर्तमान सांसद डा सुरेन्द्रकुमार यादव तथा रामगोपालपुर, मनरा र औरही नगरपालिका एवं सोनमा र सम्सी गाउँपालिकाको संयुक्त पहलकदमीमा अस्पताल सञ्चालन गरिएको हो। अस्पतालको बिहीवार प्रदेश नं २ सरकारका सामाजिक विकासमन्त्री नवलकिशोर साहले उद्घाटन गरे। मन्त्री साहले अस्पताललाई प्रदेश सरकारको साथ सहयोग रहने प्रतिबद्धता जनाएका छन्।. नेपाल–भारत सीमा दशगजा क्षेत्रबाट तीन किलोमिटर दूरीभित्र यो अस्पताल सञ्चालन गरिएको छ। जिल्लाको सुदूरपश्चिम दक्षिणी क्षेत्रमा पहिलोपटक कोभिड–१९ सङ्क्रमितको निश्शुल्क उपचार गरिने आधुनिक सुविधायुक्त अस्पताल सञ्चालनमा आएपछि सर्वसाधारणले अब आफ्नै ठाउँमा उपचार पाउने आस सँगालेका छन्। अस्पताल सञ्चालनका लागि निवर्तमान सांसद डा यादवको संसदीय विकास कोषको रकम र पाँच स्थानीय तहले संयुक्तरूपमा रकमको जोहो मिलाएका हुन्। अस्पतालमा अत्याधुनिक शय्या, अक्सिजन सुविधासहितको उपचार र बिरामीको भोजनसहितको प्रबन्ध रहेको छ।. जम्मा १५ स्थानीय तह रहेका जिल्लामा यसअघि जिल्ला सदरमुकाम जलेश्वरस्थित जिल्ला अस्पताल (जलेश्वर अस्पताल), बर्दिबासस्थित बर्दिबास अस्पताल र गौशाला नगरपालिकाको इमलीबजारस्थित स्वास्थ्यचौकीमा समेत तीन ठाउँ कोभिड–१९ अस्पताल सञ्चालनमा रहँदै आएका छन्। जिल्लाको सुदूर दक्षिणी पश्चिमी क्षेत्रमा नयाँ अस्पताल सञ्चालनमा आएपछि अब त्यस भेगका बिरामीले आफ्नै ठाउँमा उपचार पाउने अवस्थाले थप सहज भएको जिल्लास्थित कोभिड–१९ सङ्कट व्यवस्थापन केन्द्रका संयोजकसमेत रहेका प्रमुख जिल्ला अधिकारी तीर्थराज भट्टराईले प्रतिक्रिया दिए।. जिल्लामा यसपालि २०७८ वैशाख १४ गतेयता हाल बिहीवारसम्म कोभिड–१९ सङ्क्रमणले ७२ जनाको ज्यान गइसकेको छ। यस अवधिमा हालसम्म सङ्क्रमित दुर्ई हजार ३६७ जनामध्ये ५२५ जना निको भएका स्वास्थ्य कार्यालय महोत्तरीले जनाएको छ। हाल एक हजार ७७० सङ्क्रमित छन्। यीमध्ये १० जना अस्पतालको सघनकक्षमा उपचाररत रहेका र बाँकी घरमैं होम आइसोलेशनमा रहेका कार्यालयका कोभिड स्रोत व्यक्तिसमेत रहेकी जनस्वास्थ्य निरीक्षक प्रतिभा सिंहले जानकारी दिए। जिल्लामा महाव्याधि सङ्क्रमण छल्न गत वैशाख २२ यता निषेधाज्ञा जारी छ। पछिल्लो चौथोपटक जारी निषेधाज्ञा अवधि जेठ मसान्तसम्म कायम रहनेछ।",https://eprateekdaily.com/2021/06/04/14155
वैवाहिक वर्षगाँठ मानव सेवा आश्रममा,स्थानीय,प्रतीक दैनिक,"जेष्ठ २०, २०७८",वीरगंज,"वीरगंज पिपराका गुरुदेव उपाध्याय र उनकी पत्नी पदमा पोखरेल उपाध्यायले २५औं वैवाहिक वर्षगाँठ बिहीवार वीरगंज रानीघाटस्थित मानव सेवा आश्रममा मनाएका छन्।. सो अवसरमा उपाध्याय दम्पतीले आश्रममा आश्रितहरूलाई आफैंले पस्केर खाना खुवाएका थिए। आश्रित एवं आश्रमका सेवकहरूले उपाध्याय दम्पतीलाई आशीर्वचन दिनुका साथै सफल दाम्पत्य जीवनको शुभकामना दिएका थिए।. अनावश्यक खर्च गरी वर्षगाँठ मनाउनुभन्दा असहाय, अशक्त, दीनदुःखीका साथ वर्षगाँठ मनाउनु सुखदायक रहेको उपाध्यायले बताए।. उनले वैवाहिक वर्षगाँठ, जन्मदिन जस्ता अन्य खुशियाली असहाय, अशक्त, दीनदुःखीलाई आश्रय दिएको मानव सेवा आश्रममा मनाउन अरूलाई आग्रह गर्दै अबदेखि जन्मदिन, वर्षगाँठ जस्ता खुशियाली मानव सेवा आश्रममैं मनाउने बताए।. कोरोना महामारीकालमा स्वास्थ्य सुरक्षा मापदण्डको पालना गर्दै उपाध्याय दम्पती मात्रै आश्रममा पुगेको र बाँकी आश्रमकै सदस्यहरू कार्यक्रममा सहभागी भएको सञ्चारकर्मी उर्मिला सापकोटाले बताइन्।. आश्रमका संयोजक सानु गुरुङले सहजीकरण गरेको कार्यक्रममा आश्रमका सहसंयोजक मुन्ना लिम्बु र सञ्चारकर्मी सापकोटाले सहयोग पु–याएका थिए। आश्रममा असहाय, अशक्त, अपाङ्गसहित विभिन्न उमेरका ४७ जना आश्रित छन्।",https://eprateekdaily.com/2021/06/03/14129
बोदेबर्साइन नगरपालिकालाई सहयोग,स्थानीय,प्रतीक दैनिक,"जेष्ठ २१, २०७८",राजविराज,"सप्तरीको बोदेबर्साइन नगरपालिकालाई ग्लोबल आइएमई लघुवित्त वित्तीय संस्था लिमिटेडले आर्थिक सहयोग गरेको छ। कोरोना महामारी रोकथाम तथा नियन्त्रण गर्ने उद्देश्यले बोदेबर्साइन नपालाई रु २५ हजारको चेक बिहीवार हस्तान्तरण गरिएको थियो। वित्तीय संस्थाका प्रमुख योगेन्द्रप्रसाद यादवले नगरपालिकाका प्रशासनिक प्रमुख घनश्याम यादवलाई चेक हस्तान्तरण गरेका थिए। यसैगरी, संस्थाले सुरक्षाकर्मीलाई स्वास्थ्य सामग्री वितरण गरेको छ।",https://eprateekdaily.com/2021/06/04/14171
घरेलु हिंसाको आरोपमा युवक पक्राउ,स्थानीय,प्रतीक दैनिक,"जेष्ठ २१, २०७८",सर्लाही,"सर्लाहीको विष्णु गाउँपालिका–७ दुलवाका १९ वर्षीय शिवकुमार यादवलाई घरेलु हिंसाको आरोपमा प्रहरीले पक्राउ गरेको छ।. विवाहको प्रलोभनमा दलित समुदायकी युवतीमाथि अमानवीय व्यवहार गरेको आरोपमा उनलाई पक्राउ गरिएको जिल्ला प्रहरी कार्यालय सर्लाहीका प्रहरी प्रमुख प्रहरी उपरीक्षक सन्तोषसिंह राठौरले जानकारी दिए। आफूमाथि शोषण भएको भन्दै किशोरी र उनका परिवारले प्रहरी कार्यालयमा जाहेरी दिएका थिए।. किशोरीले अपहरण तथा शरीर बन्धक, जबरजस्ती करणीसम्बन्धी किटानी जाहेरी दिएको र सोही आधारमा उनलाई पक्राउ गरिएको प्रउ राठौरले बताए। पक्राउ परेका यादवलाई अदालतबाट म्याद थप गरी कारबाई प्रक्रिया अघि बढाइएको छ। किशोरीको उद्धार गरी जिल्ला सदरमुकाममा रहेको एक सेफ हाउसमा राखिएको छ।",https://eprateekdaily.com/2021/06/04/14167
