Title,Category,Auther,Date,Location,Content,URL
सचेतनाको कमीले स्वास्थ्यप्रति लापरवाही बढ्दै,स्थानीय,प्रतीक दैनिक,"बैशाख १९, २०७८",पंचगावाँ,"रुघा, खोकी, ज्वरो भएका बिरामीहरू सरकारीस्तरमा सञ्चालित स्वास्थ्य केन्द्र, चौकीहरूमा गएर उपचार गर्न छाडेर अहिले निजी क्लिनिकमा इजाजत नलिएका स्वास्थ्यकर्मीहरूलाई देखाउने र औषधिपसलेहरूस“ग सोधेर जथाभावी औषधिसेवन गर्न थालेका छन् ।. यहा“का बिरामीहरू वीरगंज र जीतपुरमा चिकित्सकहरूलाई देखाउ“दै आएका थिए । निषेधाज्ञाको कारण अहिले सो स्थानमा जान सहज नभएको र जानेहरूलाई पनि त्यहा“का चिकित्सकहरूले पिसिआर, एन्टिजेन परीक्षणपछि मात्र चेकजा“च गरिरहेको हल्ला गाउ“मा फैलिएकाले अहिले यहा“ यो अवस्था आएको हो ।. इजाजत नलिएका स्वास्थ्यकर्मी, औषधिपसलेहरूले जथाभावी एन्टिबायोटिक औषधि दिने गरेको पाइएको छ ।उपचार विधि नजानेकाहरूले एन्टिबायोटिक औषधिबाट रोग निको पार्न थालेपछि अहिले निजी क्लिनिक, औषधिपसलहरूमा भीड बढेको छ । सखुवाप्रसौनी गापा–३ का विनोद यादव भन्छन्– कुनै परीक्षणविना अन्दाजको भरमा औषधि दिने र उनीहरूले दिएको औषधिसेवन गर्नेहरूको सङ्ख्या बढेको छ । यसबाट भविष्यमा थप जोखिम निम्तन सक्ने उनले बताए ।. बलिराम शुक्ला, बिरुवागुठी/गर्मी बढेस“गै भाइरल ज्वरो र रुघाखोकीका बिरामीहरू बढेका छन् । एकजनामा लागेको ज्वरो, रुघाखोकीले घरपरिवार अनि समाजलाई प्रभावित पार्न थालेको छ । पर्सागढी नगरपालिका–३ निवासी कृष्णा कुमारीका अनुसार भाइरल ज्वरो, रुघाखोकीका बिरामी नभएका नगरपालिकामा बिरलै घर भेटिन्छन् ।. कोरोनास“ग मिल्दोजुल्दो रोगको लक्षण भएकाले अहिले पर्सागढी नगरपालिकाका मानिसहरू निजी क्लिनिकमा रोगको उपचार गराइरहेका छन् । निषेधाज्ञाले जीतपुर, वीरगंज जान नसकेका यहा“का मानिसहरू स्वास्थ्य केन्द्र, चौकी र निजी क्लिनिकमा जान थालेका हुन् । यसमध्ये केहीलाई पिसिआर, एन्टिजेन परीक्षणको लागि सुझाव दिए पनि उनीहरूले परीक्षण नगराएको एकजना स्वास्थ्यकर्मीले बताइन् । कोरोना परीक्षण गराउन सल्लाह दिएपछि केन्द्र र स्वास्थ्य चौकीमा नआउने र निजी क्लिनिक, औषधिपसलबाट औषधि खरीद गरेर सेवन गर्ने प्रचलन बढेको ती स्वास्थ्यकर्मीको बुझाइ छ ।. धर्मेन्द्र चौरसिया, पोखरिया/पोखरिया नगरपालिका र आसपासका क्षेत्रमा भाइरल ज्वरो, रुघाखोकीको प्रकोपले अधिकांश मानिस प्रभावित भएका छन्।. नगरपालिकाका ८० प्रतिशत मानिस अहिले यो समस्याबाट पीडित भएको अनुमान गरिएको छ । जिल्ला अस्पताल पोखरियाका मेडिकल सुपरिटेन्डेन्ट डा सञ्जय गुप्ताले अहिले अस्पतालको आकस्मिक कक्षमा यस प्रकारको समस्याग्रस्त करीब ५० जना बिरामी आउने गरेको बताए । उनले रोग निको हुन एकाध दिन लाग्ने बित्तिकै उनीहरू निजी क्लिनिकमा धाउने, औषधिपसलबाट जथाभावी औषधि लिएर खाने गरेको बताए । केही दिनदेखि ज्वरो निको नहुने, रुघाखोकीले सताइरहनेलाई पिसिआर परीक्षण गराउन भन्दा उनीहरू अटेर गर्दै आएको बताए । पोखरियामा स्वाब नमूना सङ्ढलन केन्द्र छ“दा यो समस्या थिएन ।. शङ्ढास्पदहरूको स्वाब लिएर नारायणी अस्पताल वीरगंज पठाउने र रिपोर्ट पोजिटिभ हुनेहरूलाई सोही अनुसारको सचेतना गराएर घरमा बस्नेलाई घरमा र अस्पताल भर्ना हुनेलाई अस्पताल भर्ना गराउने कार्य हु“दै आएकामा अहिले सबैजना वीरगंज जानुपरेकाले समस्या देखिएको हो । स्वाब दिन वीरगंज जानुपर्ने समस्याले पनि धेरैजनाले पिसिआर परीक्षण गराउन आवश्यक भएपनि गराएका छैनन् । जसले गर्दा यस प्रकारका बिरामीहरूको मृत्युपछि गाउ“टोलमा त्रासको वातावरण बन्दै गएको छ ।. सुग्रीव साह, भिस्वा/रुघा, खोकी, ज्वरो लागे पनि गाउ“टोलमैं उपचार गराउने कारणले आइतवार एकजनाको मृत्यु भएको छ । भारतीय सीमास“ग जोडिएको छिपहरमाई गाउ“पालिका–३ का एकजना ४५ वर्षीय सङ्क्रमितको आइतवार बिहान नारायणी अस्पतालमा मृत्यु भएपछि उनी बस्ने झलमहियाटोल सिल गरिएको छ । ज्वरो, रुघाखोकी हु“दा उनले टोलमैं उपचार गराएका थिए । ती लक्षणले ग्रस्त भएपछि अस्पताल लगिएका उनमा एन्टिजेन परीक्षणबाट सङ्क्रमण पुष्टि भएको थियो र लगत्तै केही घण्टामैं उनको मृत्यु भयो । उनको मृत्युपछि टोलवासीमा भयको वातावरण छाएको छ । भारतस“ग जोडिएको कारण मूल बाटो मानिसहरूको आवतजावत नभए पनि चोरबाटो आवतजावत रोकिएको छैन । अझ अहिले वैवाहिक कार्यक्रम भएकाले दुवैतर्फका मानिस ओरिया खोला भएर पैदल आवतजावत गर्दैछन् । यस्तोमा कसबाट कसमा कोरोना सर्‍यो भन्न सकिन्न । त्यसमा पनि कोरोनास“ग मिल्दोजुल्दो लक्षण हुनेहरूले पनि परीक्षण गराएर सुरक्षित हुनुभन्दा अनावश्यक औषधिसेवन गर्ने गरेका छन् । आफूखुशी सेवन गरेको औषधिबाट निको भएपछि फुर्ती देखाउने र निको नभएर समस्या बल्झिएपछि भयभीत हुने गरेको पाइएको छ । उनीहरूलाई यस विषयमा सचेत गर्न कुनै पनि संस्था वा स्थानीय तहले पहल गरेका छैनन् ।",https://eprateekdaily.com/2021/05/02/12541
५ दिनमैं घर निर्माण गर्ने प्रिन्टर,स्थानीय,प्रतीक दैनिक,"बैशाख २०, २०७८",,"यो घरको डिजाइन पनि विद्यार्थीहरूले नै गरेका हुन्। यसलाई हाउसिङ क्ष्Fेत्रमा क्रान्तिकारी प्रविधि मानिंदैछ। भविष्यमा सस्तो र बलियो घर बनाउनको लागि बिल्डको सट्टा प्रिन्ट शब्द प्रयोग हुन सक्छ। घरनिर्माणको लागि एउटा विशाल थ्रीडी प्रिन्टरको प्रयोग गरिएको थियो, जसले कम्प्युटराइज्ड थ्री डायमेन्शल डिजाइन फाइललाई स्वीकार गर्दै तह–तहमा आउटपुट दिन्छ। कच्चा सामग्रीको रूपमा यसमा सिमेन्ट, कङ्क्रिटको गारो प्रयोग गरिन्छ। यो प्रविधि आइआइटी मद्रासका मैकेनिकल र इलेक्ट्रिकल इन्जिनीयरिड्ढा तीनजना पूर्वविद्यार्थी आदित्य बिएस, विद्याशङ्कर सी र परिवर्तन रेड्डीको टिवास्ता मैन्युफैक्चरिङ सोल्युशन्सले विकसित गरेको हो।. ६ सय वर्गफिटमा बनेको यस घरमा एउटा बेडरूम, हल, भान्सा र अन्य जरुरी भाग छन्। विद्याशङ्कर भन्छन्– ठूलो मात्रामा एकसरह घर बनाउँदा पाँच दिनमा एउटा घर तयार गर्न सकिन्छ। साथै आफ्नो इच्छा अनुसारको घर पनि बनाउन सकिन्छ।. आइआइटी मद्रासका निर्देशक प्राध्यापक भास्कर राममूर्तिले भने– जसरी किसानहरूले बोरवेल भाडामा लिन्छन्, त्यसै प्रकार यो थ्रीडी प्रिन्टर पनि भाडामा लिन सकिन्छ।. – प्रतीक डेस्क (एजेन्सीको सहयोगमा)",https://eprateekdaily.com/2021/05/03/12566
आइतवार १४५ जना नयाँ सङ्क्रमित,स्थानीय,प्रतीक दैनिक,"बैशाख १९, २०७८",वीरगंज,"हिजो शनिवार सङ्ढलन गरिएका १९२ वटा स्वाबको पिसिआर परीक्षण गर्दा आज आइतवार बिहान १४५ जना सङ्क्रमित पुष्टि भएको अस्पतालका प्रवक्ता डा सरोजरोशन दासले बताए ।. सङ्क्रमित पुष्टि हुनेमा पर्साका १०९, बाराका २६, रौतहटका ६, सर्लाहीका ३ र महोतरीका १ जना छन् ।यिनीहरूमध्ये ३० जना महिला र ११५ जना पुरुष छन् ।सङ्क्रमितहरूको उमेर १८ देखि ६८ वर्षसम्म रहेको प्रवक्ता डा दासले बताए । सङ्क्रमितहरूको सिटी भ्यालू १४.५ देखि ३४.८ सम्म रहेको छ ।",https://eprateekdaily.com/2021/05/02/12539
१९३ जना सङ्क्रमित,स्थानीय,प्रतीक दैनिक,"बैशाख १८, २०७८",वीरगंज,"नारायणी अस्पतालको पिसिआर प्रयोगशालाले शनिवार १९३ जना थप सङ्क्रमित पुष्टि गरेको छ। अस्पतालका प्रवक्ता डा सरोजरोशन दासले वैशाख १७ गते २८० जनाको स्वाब नमूना सङ्कलन गरी परीक्षण गर्दा शनिवार बिहान १९३ जना सङ्क्रमित पुष्टि भएको बताए। उनले सङ्क्रमित हुनेमा पर्सा जिल्लाका १५१, बाराका ३०, रौतहटका ४, सर्लाहीका ३, चितवनका २ र नवलपरासी, धनुषा, बर्दियाका १/१ जना रहेको बताए।. सङ्क्रमित हुनेमा ५७ जना महिला र १३६ जना पुरुष रहेका छन् भने उनीहरूको उमेर अढाई वर्षदेखि ७७ वर्षसम्म रहेको उनले बताए। शनिवार बिहान सङ्क्रमित पुष्टि हुनेहरूमा सिटी भ्यालू १३.१ देखि ३५.१ सम्म रहेको प्रवक्ता डा दासले बताए।",https://eprateekdaily.com/2021/05/01/12506
आइतवार दुईजना सङ्क्रमितको मृत्यु,स्थानीय,प्रतीक दैनिक,"बैशाख १९, २०७८",वीरगंज,"अस्पतालका प्रवक्ता डा सरोजरोशन दासले सङ्क्रमित दुईजना पुरुषको आज मृत्यु भएको बताए । मृत्यु हुनेमा एकजना वीरगंज महानगरपालिका–१६ निवासी ६८ वर्षीय पुरुष छन् । वैशाख १७ गते अस्पताल भर्ना गरिएको र सोही दिन उनको पिसिआर परीक्षण रिपोर्ट सङ्क्रमित आएको थियो । सङ्क्रमित पुरुषको आइतवार बिहान एक बजे मृत्यु भएको प्रवक्ता डा दासले बताए ।. यसैगरी, पर्सा जिल्ला छिपहरमाई गाउ“पालिका–३ निवासी ४५ वर्षीय पुरुषको पनि आज बिहान १० बजे मृत्यु भएको प्रवक्ता डा दासले बताए । मृतकलाई आजै नारायणी अस्पतालमा भर्ना गरिएको र एन्टिजेन विधिबाट परीक्षण गर्दा सङ्क्रमित पुष्टि भएको प्रवक्ता दासले बताए ।",https://eprateekdaily.com/2021/05/02/12529
रौतहटमा नीलगाईको आतङ्क,स्थानीय,प्रतीक दैनिक,"बैशाख १९, २०७८",रौतहट,"स्थानीय शिक्षक ओमप्रकाश महतोले आजभोलि झुन्डका झुन्ड नीलगाई आउने र किसानले लगाएको बाली नष्ट गर्ने गरेको बताए ।. रौतहटको राजदेवी नगरपालिका र दुर्गाभगवती गाउ“पालिकामा किसानहरूले लगाएको चैते धान, मकै र तरकारी खेतीलाई नीलगाईले क्षति पुर्‍याउ“दै आएको छ । करीब दुई सातादेखि नीलगाईको आतङ्ढ बढेको छ ।. दिउ“सै आउने नीलगाईलाई किसानहरूले धपाउन थालेपछि अहिले रातिपख आएर बालीलाई क्षति पुर्‍याउने गरेको एकजना किसानले बताए ।",https://eprateekdaily.com/2021/05/02/12526
शनिवार दुईजना सङ्क्रमितको मृत्यु,स्थानीय,प्रतीक दैनिक,"बैशाख १८, २०७८",वीरगंज,नारायणी अस्पताल र नेशनल मेडिकल कलेज कोरोना विशेष अस्पतालमा शनिवार दुईजना सङ्क्रमितको मृत्यु भएको छ। जिल्ला प्रशासन कार्यालय पर्साका प्रशासकीय अधिकृत विनयकुमार श्रीवास्तवले नारायणी अस्पतालमा वीरगंज महानगरपालिका–८ निवासी ७० वर्षीया महिलाको मृत्यु भएको बताए। सङ्क्रमित महिलाको पिसिआर रिपोर्ट वैशाख १६ गते पोजिटिभ आएको र उनलाई अस्पतालमा भर्ना गरिएकोमा शनिवार दिउँसो १२ बजे मृत्यु भएको बताए।. यसअघि नेशनल मेडिकल कलेज कोरोना विशेष अस्पतालमा वीरगंज महानगरपालिका–७ निवासी ६० वर्षीय पुरुषको शनिवार बिहान ६ बजे मृत्यु भएको उनले बताए। वैशाख १५ गते पिसिआर रिपोर्ट पोजिटिभ आएपछि ती पुरुषलाई नेशनल मेडिकल कलेजको कोरोना विशेष अस्पतालमा भर्ना गरिएको थियो।,https://eprateekdaily.com/2021/05/01/12504
ठोरीका सहकारी अनिश्चिकालका लागि बन्द,स्थानीय,प्रतीक दैनिक,"बैशाख १९, २०७८",ठोरी,गापामा रहेका सहकारी सञ्चालकहरूको आइतवार बसेको अनौपचारिक भेलाले सोमवारदेखि अनिश्चितकालका लागि सहकारी सेवा बन्द गर्ने सहमति भएको सयपत्री बचत तथा ऋण सहकारी संस्थाका व्यवस्थापक सन्तोष श्रेष्ठले बताए । उनले कोरोनाको सङ्क्रमण बढ्दै गएको र सेवाग्राही पनि सहकारी खुलेबाट प्रभावित हुन सक्ने कुरालाई मध्यनजर गर्दै बन्द गर्ने सहमति भएको बताए ।. ठोरीमा सङ्क्रमितहरूको सङ्ख्या बढ्दै गएको र आम मानिसमा त्रास फैलिएको कारण सहकारी सेवा अर्को सूचना जारी नहुन्जेलसम्मका लागि बन्द गरिएको उनले बताए ।,https://eprateekdaily.com/2021/05/02/12524
फरार दुईजना कारागार चलान,स्थानीय,प्रतीक दैनिक,"बैशाख १९, २०७८",वीरगंज,बारा प्रहरीका प्रवक्ता प्रनाउ गौतम मिश्रले लागूऔषध गा“जा मुद्दामा बारा जिल्ला अदालतबाट २०७४/५/५ मा एक वर्ष कैद र दश हजार रुपैया“ जरिवाना भएपछि फरार कलैया उपमहानगरपालिका–५ निवासी मनीषा गिरी र चोरी मुद्दामा डेढ महीना कैद र १२ हजार रुपैया“ जरिवाना भएपछि फरार कलैया उपमहानगरपालिका–१ निवासी बृजकिशोर पटेललाई निजहरूको घरबाट पक्राउ गरी अदालतमा हाजिर गराएको र अदालतको आदेशबमोजिम कैद भुक्तानको लागि बन्दी सुधारगृह वीरगंज चलान गरिएको बताए ।,https://eprateekdaily.com/2021/05/02/12537
चरेससहित एकजना पक्राउ,स्थानीय,प्रतीक दैनिक,"बैशाख १९, २०७८",वीरगंज,छापामारीको क्रममा चरेस बरामद भएपछि कुर्मीलाई पक्राउ गरिएको जिप्रका पर्साले जानकारी गराएको छ ।पक्राउ परेका कुर्मीलाई आजै पर्सा जिल्ला अदालतमा मुद्दा दायर गरी पा“च दिनको थुना आदेश गराइ हिरासतमा राखेर थप अनुसन्धान भइरहेको सो कार्यालयले जनाएको छ ।,https://eprateekdaily.com/2021/05/02/12535
