Title,Category,Auther,Date,Location,Content,URL
क्याटद्वारा प्रजिअको ध्यानाकर्षण,स्थानीय,प्रतीक दैनिक,"जेष्ठ ४, २०७८",विन्दवासिनी,"टीमका अध्यक्ष जिसस पर्साका सभापति नेकमहमद अन्सारीको नेतृत्वमा मङ्गलवार पर्साका प्रजिअ घिमिरेसँगको छलफलमा प्रजिअ घिमिरेले क्याट र स्थानीय प्रशासनको एउटै लक्ष्य कोरोनाविरुद्धको अभियान भएकोले सहकार्य गरी अगाडि बढ्ने आश्वासन दिएका हुन् ।. क्याटका अध्यक्ष अन्सारीले वीरगंजका अस्पतालहरूमा अक्सिजनको अभाव हुन सक्ने सङ्केत गर्दै सोसम्बन्धी व्यवस्थापन सहज बनाउन आग्रह गरेको क्याटका तबरेज अहमदले बताए ।. सो अवसरमा क्याटले आइतवार र सोमवार वीरगंजका अस्पतालमा गरेको अनुगमन र त्यहाँ देखिएका समस्याहरूको बारेमा पनि प्रजिअको ध्यानाकर्षण गराइएको थियो ।. अध्यक्ष अन्सारीले अवसरमा नागरिकको गुनासो समेटेर तयार पारिएको सुझावपत्र पनि प्रजिअलाई बुझाएका थिए ।छलफलमा क्याटका सदस्यहरू श्याम पटेल, बाबुराम कौशिक, सञ्जीव मिश्र, अमित अग्रवालसमेतको सहभागिता थियो।",https://eprateekdaily.com/2021/05/18/13281
सुक्दै इनार ः चुरे बस्तीका बासिन्दा चिन्तित,स्थानीय,प्रतीक दैनिक,"जेष्ठ २, २०७८",निजगढ,"स्थानीय मञ्जुश्री आधारभूत विद्यालय नजीकको इनार सुकेको सात वर्ष भयो । इनार सुकेपछि विद्यालयलगायत आसपासका बस्तीमा पिउने पानीको समस्या हँुदै आइरहेको स्थानीय समाजसेवी सोनामसिंह गोलेले बताए । बस्तीदेखि माथिको चुरे पहाडबाट पाइपमा ल्याएको पानी बस्तीका लागि पर्याप्त नहुने उनले बताए । वर्षामा पहिरोले पाइप क्षति पुर्‍याउँदा पानीको हाहाकार मच्चिने गरेको अर्का स्थानीय समाजसेवी नरेन्द्रमान लुङ्गवा बताउँछन् । यस अघि इनार मरम्मत गर्दा पानीको स्रोतले दुई/चार वर्ष थेगे पनि पछि पानीको सतह घटेको उनले बताए ।. पहिले २०/२५ फिटमा पानी आउने इनार सफा गर्दागर्दै ४०/५० फिट गहिरो भइसक्दा पनि पानीको स्रोत नभेट्दा अहिले सो इनार मरम्मत गर्न छाडिएको उनले बताए । चुरे फेद मानवबस्ती नजीकैको पूर्वी धापमा रहेको एउटा सानो इनारले गाईवस्तुलगायत अन्य प्रयोजनका लागि जेनतेन पानीको जोहो हँुदै आइरहेको बुद्धज्योति सामुदायिक वन उपभोक्ता समूहका अध्यक्ष ज्ञानबहादुर दोङ्ग बताउँछन् । उनले पानीको स्रोत संरक्षणमा बेलैमा ध्यान पुर्‍याउन जरुरी भएको बताए।. चुरे फेद र आसपासका क्षेत्र भावर क्षेत्र हो । जहाँ पानीको सतह लुक्छ । केही दूरी पर पुगेपछि पानीको सतह माथि उठ्छ । तर विगतभन्दा पानीको सतह दब्दै जानुले सङ्केत राम्रो नदेखिएको यहाँका बुढापाकाहरू बताउँछन् ।. राष्ट्रपति चुरे—तराई मधेस संरक्षण विकास समितिले यस क्षेत्रमा पोखरी, तालतलैया निर्माणका लागि काम गर्दा केही हदसम्म पानीको स्रोत संरक्षण हुने तर ती स्थानमा अहिलेसम्म ध्यान नगएको स्थानीयको गुनासो छ । स्थानीय तह, वन कार्यालयलगायत सम्बन्धित निकायहरूले यस क्षेत्रमा पनि पोखरी निर्माणका लागि बजेट विनियोजन गरी काम गर्न पहल गर्नुपर्ने यहाँका मानिसको माग छ ।",https://eprateekdaily.com/2021/05/16/13216
सानो पाइलाद्वारा तीन थान भेन्टिलेटर सहयोग,स्थानीय,प्रतीक दैनिक,"जेष्ठ ३, २०७८",वीरगंज,"अस्पतालका निमित्त मेडिकल सुपरिटेन्डेन्ट डा. ऐनामुलक हकलाई सानो पाइलाका दीपेश सर्राफसहितको टोलीले तीन थान भेन्टिलेटर हस्तान्तरण गरेको हो । नारायणी अस्पतालमा भेन्टिलेटरको अभाव रहेकोले सो संस्थाले सामाजिक सेवा अन्तर्गत भेन्टिलेटर सहयोग गरेको सानो पाइलाका कार्यकारी निर्देशक कञ्चन झाले बताए ।. भेन्टिलेटरमा जडान हुने एल्बो किट, नोजल क्यानुला, वाटर चैम्बर र प्याटेन्ट सर्किटलगायतका चार सेट मेडिकल उपकरण एनपिएल समाज कल्याण संस्था वीरगंजसँगको समन्वयमा प्राप्त भएको हो । राष्ट्रिय आविष्कार केन्द्रबाट प्राप्त भएको अक्सिजन स्पिल्टिर पाँच सेट पनि नारायणी अस्पताललाई हस्तान्तरण गरिएको सो संस्थाले जनाएको छ ।यस्ता उपकरणको सहायताले एउटै अक्सिजन सिलिन्डरबाट दुईजना बिरामीलाई अक्सिजन सर्पोट दिन सकिने बताइएको छ ।",https://eprateekdaily.com/2021/05/17/13251
१३ थान मोबाइल बरामद,स्थानीय,प्रतीक दैनिक,"जेष्ठ २, २०७८",रौतहट,प्रहरी चौकी मठियाले इशनाथ नगरपालिका-४ लतमरीबाट १३ थान विभिन्न मोडल र कम्पनीको मोबाइल बरामद गरेको र सोको बजार मूल्य अढाई लाख पर्ने जिप्रका रौतहटले जनाएको छ ।. बरामद मोबाइल सम्बन्धमा आवश्यक कार्यवाही भइरहेको सो कार्यालयले जनाएको छ ।,https://eprateekdaily.com/2021/05/16/13219
ग्रीन सिटीद्वारा निश्शुल्क अक्सिमीटर वितरण,स्थानीय,प्रतीक दैनिक,"जेष्ठ ३, २०७८",वीरगंज,"विभिन्न सङ्घ संस्था र नागरिकलाई आफ्नो किसिमले सेवा प्रदान गरिरहेको क्रममा सङ्क्रमणको बेला निश्शुल्क अक्सिजन सेवा, एम्बुलेन्स सेवा, सुरक्षाकर्मीहरूलाई खाजापानीको व्यवस्था अनि बिरामीका लागि रक्सौलबाट औषधी ल्याइदिने सेवा गर्दै आएको ग्रीनसिटीले हिजो ८० वटा अक्सिमिटर वितरण गरेको छ ।. अहिले सङ्क्रमितहरूको अक्सिजन मात्र चेकजाँच गर्नका लागि अक्सिमिटरको माग बढेसँगै सेवा भावनाले विभिन्न सङ्घसंस्था, व्यक्तिलाई अक्सिमिटर प्रदान गरिएको ग्रीनसिटीका अध्यक्ष प्रकाश खेतानले बताए ।पवन रूङ्गटाको सहयोगमा सो अक्सिमिटर वितरण गरिएको उनले बताए ।. कार्यक्रममा पत्रकार कन्हैया केशरी, राम सर्राफ, बिर्ता प्रहरी कार्यालयका प्रहरी निरीक्षक राजेशराज पुरी, एसटिएफका गोकुल बस्याँल, वीरगंज महानगरका सरफुद्दीन मियाँ, मुन्ना सर्राफ, ग्रीन सिटीका ज्योति रूङ्गटा, सुशील कादमिया, त्रिलोक दारूका, राकेश अग्रवाल, चन्दन अग्रवाल, कैलाश बजाजलगायतको सहभागिता थियो ।",https://eprateekdaily.com/2021/05/17/13256
कोभिड विरुद्ध लड्न एक्सन टिम अझ सक्रिय हुने -अन्सारी,स्थानीय,प्रतीक दैनिक,"जेष्ठ २, २०७८",वीरगंज,"कोभिड एक्सन टिमका संयोजक एवं जिल्ला समन्वय समितिका सभापति नेकमहम्मद अन्सारीको अध्यक्षतामा बसेको बैठकले स्थानीयको सहयोगका लागि अझ बढी सक्रियताका साथ लाग्ने निणर्य गरेको सदस्य तबरेज अहमदले बताए ।. टिमले कोभिडको नयाँ भेरिएन्ट फैलिएको बेला सहयोगदेखि उपचारमा खटेका स्वास्थ्यकर्मी, चिकित्सक, नर्सलगायतलाई धन्यवाद दिंदै कोरोना भाइरस वा सामान्य रोगका बिरामीलाई समेत कतिपय अस्पतालहरूले भर्ना नलिरहेको भनेर आइरहेको गुनासोप्रति ध्यानाकर्षण भएको जनाएको छ । टिमले अस्पतालका सेवा सुविधा नागरिक मैत्री बनाई सुरक्षित साथ सहज ढङ्गले सेवा प्रवाह गर्न आग्रह गरेको सदस्य अहमदले बताए ।. त्यस्तै बैठकले संयोजक अन्सारीको नेतृत्वमा पर्साका अस्पतालहरूको सेवा सुविधाको प्रभावकारिता र भौतिक संरचनाको अवस्थाबारे अनुगमन गरिने निणर्य गरेको छ । बैठकले कोरोना सङ्क्रमण समुदायमा फैलिएको बेला सर्वसधारणलाई संयमता अपनाई सुरक्षित बस्नसमेत अपील गरेको छ ।",https://eprateekdaily.com/2021/05/16/13229
वीरगंज महानगरद्वारा चारवटा संस्थालाई खाद्यान्न सहयोग,स्थानीय,प्रतीक दैनिक,"जेष्ठ २, २०७८",वीरगंज,"महानगरपालिकाका नगरप्रमुख विजयकुमार सरावगीले महानगरपालिकामा निश्शुल्क भोजन गराउन चाहने सङ्घ संस्थाहरूलाई खाद्यान्न व्यवस्था गराउने घोषणा अनुसार निश्शुल्क भोजन गराउँदै आएका चारवटा संस्थालाई खाद्यान्न वितरण गरेका हुन् ।. नगरप्रमुख सरावगीले सानो पाइला संस्थालाई २८ बोरा चामल, ३५ किलो दाल र २८ लिटर खानेतेल, इम्प्रुभिङ वीरगन्ज संस्थालाई ७ बोरा चामल, ३५ किलो दाल र ५० लिटर तेल हस्तान्तरण गरेका थिए । त्यस्तै १०० ग्रुप नेपाल संस्थालाई १२५ किलो चामल, २५ किलो दाल र २१ लिटर खानेतेल तथा होटल रेल्वे कटेजलाई ३० बोरा चामल, २ बोरा दाल र ६० लिटर खानेतेल हस्तान्तरण गरेका थिए ।. वीरगंज महानगरमा निषेधाज्ञा लागू भएपछि बिहान बेलुका ज्यालादारी गरेर छाक टार्ने गरीब विपन्नलाई समस्या हुन नदिन समर्पण सेवा संस्थाको सहयोगमा साहिब दरबार सेवा संस्था, रेल्वे कटेज लगायतले १० दिनदेखि निरन्तर निश्शुल्क भोजन गराउँदै आएका छन् ।",https://eprateekdaily.com/2021/05/16/13221
वीरगंजका बैंकहरूले फुलफेजको नकद कारोबार गर्ने,स्थानीय,प्रतीक दैनिक,"जेष्ठ २, २०७८",वीरगंज,"मुलुकको प्रमुख आर्थिक राजधानी, आयात-निर्यात, व्यापार एवं कोरोना महामारीमा उपचारका लागि नगद कारोबार अति आवश्यक भएको भन्दै वीरगंज बैंकर्स एसोसिएशनले फूलफेजको नगद कारोबारलाई स्वास्थ्य मापदण्ड पालना गरी सुविधा दिने वीरगंज बैंकर्स एसोसिएशनका अध्यक्ष नीतेश खडकीले बताए ।. सनराइज बैंकका प्रबन्धक र एसोसिएशनका अध्यक्ष खडकीले सूचना जारी गर्दै कोरोना महामारीको कारण वीरगंजको विभिन्न बैंकका ९१ जना कर्मचारी सङ्क्रमित भए तापनि बैंकहरूले नगद कारोबार बन्द हुँदा जनजीवन तथा व्यापार प्रभावित भएकोले फूलफेजको नगद कारोबारसहितको बैंकिङ सेवा उपलब्ध गराउन वीरगंजका बैंकहरू अग्रसर रहेको बताए।. उनले बिहान १० बजेदेखि दिउँसो २ बजेसम्म बैंकले नगद तथा अन्य भन्सार प्रयोजनका अतिआवश्यक सेवा उपलब्ध गराउने बताए । एसोसिएशनले अति आवश्यक भए मात्र चेक वा नगद कारोबार गर्न बैंकमा आउने र बढिभन्दा बढी विद्युतीय सेवालाई उपभोग गर्न पनि ग्राहकहरूलाई अपिल गरेको छ ।",https://eprateekdaily.com/2021/05/16/13224
अक्सिजन प्लान्टका लागि सहयोग,स्थानीय,प्रतीक दैनिक,"जेष्ठ ३, २०७८",वीरगंज,नगरप्रमुख सरावगीले आफ्नो फेसबूक पेजमार्पmत नारायणी अस्पतालमा अक्सिजन प्लान्ट जडानको लागि सहयोग आह्वान गरेका थिए ।. नगरप्रमुख सरावगीले पहिलो कोरोना सङ्क्रमणमा सबैको सहयोगमा एक करोड मूल्यको पिसिआर मेशिनसहित केही स्वास्थ्य उपकरण नारायणी अस्पताललाई सहयोग गरेको बताएका थिए । अक्सिजन प्लान्टको लागि करीब रु दुई करोड आवश्यक हुने बताइएको छ ।. पर्साका सांसद विमलप्रसाद श्रीवास्तवले यसअघि नारायणी अस्पताललाई आफ्नो संसदीय विकास कोषबाट रु दुई करोड अक्सिजन प्लान्ट जडानका लागि दिने घोषणा गरिसकेका छन् । दोस्रो चरणको कोरोना शुरू हुनुअघि नै उनले यस्तो घोषणा गरे पनि अस्पतालले अक्सिजन प्लान्ट जडानमा चासो देखाएको थिएन ।,https://eprateekdaily.com/2021/05/17/13248
२८८ जनाको परीक्षणबाट १२४ जना सङ्क्रमित थप,स्थानीय,प्रतीक दैनिक,"जेष्ठ ३, २०७८",वीरगंज,"थप सङ्क्रमितमा पर्साका ८८ जना, बाराका २० जना, रौतहतका १३ जना, सर्लाहीका दुईजना र धनुषाका एकजना गरी कुल १२४ जना सङ्क्रमित पुष्टि भएको संयोजक डा दासले बताए ।सङ्क्रमित ९ देखि ७७ वर्ष उमेर समूहका ९१ जना पुरुष र ३३ जना महिला रहेको र उनीहरूको सिटी भ्यालू १६ देखि ३५ सम्म रहेको उनले जानकारी गराए ।. यसैबीच, पर्सा जिल्लाका १८ वटा अस्पतालका ५९७ वटा शøयामा अहिलेसम्म ३६३ जना सङ्क्रमित रहेको र २३४ वटा शøया खाली रहेको बताइएको छ । सङ्क्रमितमध्ये ११० जना महिला र २५० जना पुरुष छन् ।यसैगरी, उनीहरूमध्ये पर्सा जिल्लाका १५७ जना रहेको र बाँकी ९४ जना अन्य जिल्लाका छन् । १८ वटा अस्पतालमा आइसियू १४५ शøया भने भरिभराउ छन् ।. त्यसैगरी, ४४ वटा भेन्टिलेटरमध्ये ३५ वटामा सङ्क्रमित छन् भने ११ वटा अहिले पनि खाली छ । यसैगरी, ११८९ वटा अक्सिजन सिलिन्डर रहेकामा अहिले ६०५ वटा मात्र प्रयोगमा रहेको र ५८४ वटा सिलिन्डर प्रयोगमा आउन सकेको छैन ।",https://eprateekdaily.com/2021/05/17/13246
उपमहानगरद्वारा अवैध काठ ढुवानी,स्थानीय,प्रतीक दैनिक,"जेष्ठ ३, २०७८",जीतपुर,गाडी जीतपुरसिमरा उपमहानगरपालिकाको भएको र सो गाडीका चालकले प्रारम्भिक बयानमा वडा नं ६ का अध्यक्ष केदारनाथ बजगाइँको आदेशमा काठ ढुवानी गरेको बताएका छन् ।,https://eprateekdaily.com/2021/05/17/13254
